User Input,Chatbot Response,Timestamp
hi,Hey,2024-12-09 10:41:16
hello,Hi there,2024-12-09 10:41:27
some food suggestion,"Gardening tips include choosing the right plants for your climate, watering properly, and using organic fertilizers.",2024-12-09 10:41:46
hi,Hello,2024-12-09 10:45:29
goodbye,See you later,2024-12-09 11:03:54
hello,Hey,2024-12-09 11:21:32
what about you,Yes I am a chatbot ,2024-12-09 11:21:48
are you a chatbot ?,I'm a chatbot here to help you ,2024-12-09 11:22:09
what about weather,I'm a chatbot here to help you ,2024-12-09 11:26:06
weather report,My purpose is to assist you,2024-12-09 11:26:25
weather report,"I'm sorry, I cannot provide real-time weather information.",2024-12-09 11:27:41
today's weather,"I'm sorry, I cannot provide real-time weather information.",2024-12-09 11:29:29
goodbye,Goodbye,2024-12-09 11:29:44
hi ,Hi there,2024-12-09 11:29:55
help me ,Yes I'm here to solve your problem,2024-12-09 11:30:08
help me ,I'm here to help. What's the problem?,2024-12-09 11:32:11
I am in trouble,"Sure, what do you need help with?",2024-12-09 11:32:31
do you know your age,I was just born in the digital world.,2024-12-09 11:34:03
please tell me weather report,"I'm sorry, I cannot provide real-time weather information.",2024-12-09 11:34:53
weather,"Opps sorry, I am a chatbot ,I can't give you proper weather report, please open your goggle and type today's weather for any kind of information.",2024-12-09 11:35:03
please help me for making budget,"To make a budget, start by tracking your income and expenses. Then, allocate your income towards essential expenses like rent, food, and bills. Next, allocate some of your income towards savings and debt repayment. Finally, allocate the remainder of your income towards discretionary expenses like entertainment and hobbies.",2024-12-09 11:42:41
please help me for making budget,"Creating a budget involves a step-by-step process to manage your income and expenses effectively. Here's how you can create one:1. Understand Your Income,2. Track Your Expenses,3. Set Financial Goals,4. Allocate Your Income,5. Create a Spending Plan,6. Monitor and Adjust,7. Use Tools,7. Use Tools",2024-12-09 11:42:58
what is credit,Yes I am a chatbot ,2024-12-09 11:45:40
what is credit_score,My purpose is to assist you,2024-12-09 11:45:58
What is a credit score,You can check your credit score for free on several websites such as Credit Karma and Credit Sesame.,2024-12-09 11:46:42
What is a credit score,You can check your credit score for free on several websites such as Credit Karma and Credit Sesame.,2024-12-09 11:46:57
How can I improve my credit score,"A credit score is a numerical representation of your creditworthiness, which indicates how likely you are to repay borrowed money. It is used by lenders, such as banks and credit card companies, to evaluate the risk of lending you money or approving you for financial products like loans, mortgages, or credit cards.",2024-12-09 11:47:29
How can I improve my credit score,"A credit score is a number that represents your creditworthiness. It is based on your credit history and is used by lenders to determine whether or not to lend you money. The higher your credit score, the more likely you are to be approved for credit.",2024-12-09 11:52:57
How can I improve my credit score,"Improving your credit score requires consistent effort and responsible financial habits. Here’s a step-by-step guide to help you boost your score:1. Pay Bills on Time,2. Reduce Credit Card Balances,3. Check Your Credit Report for Errors,3. Check Your Credit Report for Errors,3. Check Your Credit Report for Errors,4. Avoid Closing Old Credit Accounts,5. Limit New Credit Applications,6. Diversify Your Credit Mix,7. Pay Off Debts Strategically,8. Become an Authorized User,9. Use Credit Responsibly,10. Seek Professional Help if Needed",2024-12-09 11:53:06
food,"samossa,pakora,bhel puri,panipuri,mathri",2024-12-09 12:21:44
what is food,You can check it in google,2024-12-09 12:22:08
what is food,Biryani - Fragrant rice dish cooked with spices and meat/vegetables.Butter Chicken - Creamy tomato-based chicken curry. Paneer Tikka - Grilled cubes of paneer marinated in spices.Masala Dosa - Crispy rice crepe filled with spiced potato filling. Rogan Josh -Aromatic lamb curry from Kashmir.Chole Bhature - Spicy chickpea curry served with deep-fried bread.Pani Puri (Gol Gappa) - Hollow fried balls filled with tangy and spicy water.Aloo Paratha -Stuffed flatbread with spiced mashed potatoes.,2024-12-09 12:22:51
suggest me some snacks or food,"Food refers to any substance that provides nutrients and energy to support life, growth, and overall well-being in living organisms. It is consumed by humans, animals, and plants to sustain biological functions.",2024-12-09 12:23:17
movie,"3 Idiots,Dilwale Dulhania Le Jayenge,Bahubali (Series) ,Lagaan,Drishyam",2024-12-09 12:28:20
fit,"I'm chatbot, I can't provide you real time please open you google and type.",2024-12-10 11:39:59
fittnes,"I'm chatbot, I can't provide you real time please open you google and type.",2024-12-10 11:40:13
fitnes,"I'm chatbot, I can't provide you real time please open you google and type.",2024-12-10 11:40:32
fitness,"Maintain a Balanced Diet,Exercise Regularly, Get Adequate Sleep,Manage Stress,Regular Health Check-ups, Build Healthy Relationships,Avoid Harmful Habits,Practice Good Hygiene,Stay Informed",2024-12-10 11:40:41
hi,Hi there,2024-12-10 11:50:35
,"I'm chatbot, I can't provide you real time please open you google and type.",2024-12-10 12:04:34
happy,"I'm chatbot, I can't provide you real time please open you google and type.",2024-12-10 12:04:47
hi,Nothing much,2024-12-10 12:04:59
hi,"I'm fine, thank you",2024-12-10 12:05:15
fitness,"To stay healthy, maintain a balanced diet, engage in regular physical activity, get enough sleep, manage stress, and avoid harmful habits.",2024-12-10 12:05:51
code,"Coding is the process of writing instructions for computers to execute tasks. It powers software, websites, and apps.",2024-12-10 12:06:06
sport,"I'm chatbot, I can't provide you real time please open you google and type.",2024-12-10 12:06:16
sports,"Team Sports: Cricket,Football (Soccer),Basketball,Volleyball,Baseball,Hockey (Field and Ice),Rugby,Kabaddi,Handball,Water Polo",2024-12-10 12:06:29
tour,You can check the time on your device or use a clock.,2024-12-10 12:13:28
tour,"I'm a chatbot,I don't have feelings, but I can provide you some option : Darjeeling,Manali,Puri,Sundarban,Malda,Delhi,Mumbai,Koyembatur,Kochi,Patna",2024-12-10 12:14:30
